,Unnamed: 0.5,Unnamed: 0.4,Unnamed: 0.3,Unnamed: 0.2,Unnamed: 0.1,Unnamed: 0,source,url,headline,text,published,collected_at
94,,,,,,,techcrunch,https://techcrunch.com/2026/01/09/meta-signs-deals-with-three-nuclear-companies-for-6-plus-gw-of-power/,Meta signs deals with three nuclear companies for 6-plus GW of power,"Meta today announced three deals to provide its data centers with nuclear power: one from a startup, one from a smaller energy company, and one from a larger company that already operates several nuclear reactors in the U.S. Oklo and TerraPower, two companies developing small modular reactors (SMR), each signed agreements with Meta to build multiple reactors, while Vistra is selling capacity from its existing power plants. Nuclear power has become a favored power source for tech companies as their AI ambitions have grown, providing stable 24/7 electricity. Startups and existing reactors have benefited from the race for data center power, though in different ways. Existing reactors tend to be the cheapest form of baseload capacity, but there are only so many to go around, which has pushed Meta and its peers toward SMR startups. Companies like Oklo and TerraPower are betting that by building a large number of smaller reactors, they’ll be able to bring the cost down through mass manufacturing. It’s a plausible hypothesis, though one that has yet to be tested. Meta’s deal could give SMR startups a chance to prove it. The deals are the result of a request for proposals that Meta issued in December 2024, in which Meta sought partners that could add between 1 to 4 gigawatts of generating capacity by the early 2030s. Much of the new power will flow through the PJM interconnection, a grid which covers 13 Mid-Atlantic and Midwestern states and has become saturated with data centers. The 20-year agreement with Vistra will have the most immediate impact on Meta’s energy needs. The tech company will buy a total of 2.1 gigawatts from two existing nuclear power plants, Perry and Davis-Besse in Ohio. As part of the deal, Vistra will also add capacity to those power plants and to its Beaver Valley power plant in Pennsylvania. Together, the upgrades will generate an additional 433 MW and are scheduled to come online in the early 2030s. Techcrunch event Join the Disrupt 2026 Waitlist Add yourself to the Disrupt 2026 waitlist to be first in line when Early Bird tickets drop. Past Disrupts have brought Google Cloud, Netflix, Microsoft, Box, Phia, a16z, ElevenLabs, Wayve, Hugging Face, Elad Gil, and Vinod Khosla to the stages — part of 250+ industry leaders driving 200+ sessions built to fuel your growth and sharpen your edge. Plus, meet the hundreds of startups innovating across every sector. Join the Disrupt 2026 Waitlist Add yourself to the Disrupt 2026 waitlist to be first in line when Early Bird tickets drop. Past Disrupts have brought Google Cloud, Netflix, Microsoft, Box, Phia, a16z, ElevenLabs, Wayve, Hugging Face, Elad Gil, and Vinod Khosla to the stages — part of 250+ industry leaders driving 200+ sessions built to fuel your growth and sharpen your edge. Plus, meet the hundreds of startups innovating across every sector. San Francisco | WAITLIST NOW Meta is also buying 1.2 gigawatts from young provider Oklo. Under its deal with Meta, Oklo is hoping to start supplying power to the grid as early as 2030. The SMR company went public via SPAC in 2023, and while Oklo has landed a large deal with data center operator Switch, it has struggled to get its reactor design approved by the Nuclear Regulatory Commission. If Oklo can deliver on its timeline, the new reactors would be built in Pike County, Ohio. The startup’s Aurora Powerhouse reactors each produce 75 megawatts of electricity, and it will need to build more than a dozen to fulfill Meta’s order. TerraPower is a startup co-founded by Bill Gates, and it is aiming to start sending electricity to Meta as early as 2032. It has designed a reactor that uses molten sodium to transfer energy from reactor to generator. When demand is low, the superheated salt can be stored in an insulated vat until more power is needed. The reactor can generate 345 megawatts of electricity, while the storage system can provide an additional 100 to 500 megawatts for more than five hours. The company has navigated the NRC process more smoothly, and it is working with GE Hitachi to build its first power plant in Wyoming. Its first two reactors for Meta would provide 690 megawatts, and Meta said it has rights to buy another six units for a total of 2.8 gigawatts of nuclear capacity and 1.2 gigawatts of storage. Meta did not disclose financial terms of the deals. The power purchases from Vistra are certain to be the cheapest — electricity from already operating nuclear reactors is among the cheapest on the grid. Costs for SMRs still have yet to be worked out. Several startups have aggressive cost targets: TerraPower has estimated that it can bring it down to $50 to $60 per megawatt-hour, while Oklo has said it is aiming for $80 to $130 per megawatt-hour. Those figures are for later power plants — the first examples are likely to cost more.","Fri, 09 Jan 2026 17:51:15 +0000",2026-01-10 20:45:01.763252
95,,,,,,,techcrunch,https://techcrunch.com/2026/01/09/x-restricts-groks-image-generation-to-paying-subscribers-only-after-drawing-the-worlds-ire/,X restricts Grok’s image generation to paying subscribers only after drawing the world’s ire,"In Brief Elon Musk’s AI company has restricted Grok’s controversial AI image-generation feature to only paying subscribers on X, after the tool invited heavy criticism from across the world for letting users generate sexualized and nude images of women and children. In replies to users on Friday, Grok said only paying subscribers on X would be able to generate and edit images on the platform. Notably, these limits do not apply to the Grok app, which, at the time of publication was letting anyone generate pictures without having to pay for a subscription. Initially available to anyone with daily limits, Grok’s image-generation feature allowed users to upload anyone’s picture and ask it to edit it or generate a sexualized or nude version. What ensued was a veritable flood of non-consensual sexualized images of children, actors, models and prominent figures, drawing the ire of multiple nations. X and Musk have both publicly denounced the use of the tool to produce such images, writing that the company would stick to its policies against posting illegal content on the social media platform. “Anyone using grok to make illegal content will suffer the same consequences as if they upload illegal content,” Musk tweeted last week. The U.K., the European Union, and India have all publicly denounced X and Grok for allowing such use of its capabilities. The EU on Thursday asked xAI to retain all documentation relating to the chatbot, and India’s communications ministry last week ordered X to make immediate changes to stop the image-generation features from being misused or risk its safe harbor protections in the country. The U.K.’s communications watchdog said it’s been in touch with xAI over the issue as well.","Fri, 09 Jan 2026 13:59:24 +0000",2026-01-10 20:45:02.088011
96,,,,,,,techcrunch,https://techcrunch.com/2026/01/09/the-venture-firm-that-ate-silicon-valley/,The venture firm that ate Silicon Valley just raised another $15 billion,"Andreessen Horowitz just announced the firm has raised a little more than $15 billion in new funding. The haul represents over 18% of all venture capital dollars allocated in the United States in 2025, according to firm co-founder Ben Horowitz, but even more jaw-dropping is that it brings the organization to more than $90 billion in assets under management, putting it neck-and-neck with Sequoia Capital as among the largest venture firms in the world. Which is fitting, since a16z appears to be very friendly with actual sovereign wealth funds, including at least one from Saudi Arabia. The firm, which employs many hundreds of people across five offices — three in California, plus New York and Washington, D.C. — has become a globe-spanning operation with employees on six continents. In December, it opened its first Asia office in Seoul for its crypto practice. That newly committed capital breaks down across five funds: $6.75 billion for growth investments, $1.7 billion each for apps and infrastructure, $1.176 billion for “American Dynamism” (more on that shortly), $700 million for biotech and healthcare, and another $3 billion for other venture strategies. It’s the kind of money that makes you wonder where it all comes from and, more importantly, where it all goes. The “where it comes from” question is one the firm has historically declined to answer. When we asked a16z this week about its limited partners and its distributed-to-paid-in capital ratio — the DPI, or how much actual cash the firm has returned to investors over its 16-year history — the firm didn’t respond. What we do know is that CalPERS invested $400 million in 2023, marking the first time in a16z’s history it took money from a major California pension fund, probably because institutions with transparency requirements don’t really align with the firm’s preference for opacity. We also know that Sanabil Investments, the venture arm of Saudi Arabia’s Public Investment Fund, lists Andreessen Horowitz among its portfolio holdings. The Saudi connection isn’t subtle. Back in 2023, Horowitz and Marc Andreessen appeared onstage with WeWork co-founder Adam Neumann to discuss their $350 million investment in his then-new residential real estate venture, Flow. The venue was a conference backed by one of Saudi Arabia’s largest sovereign funds. Horowitz praised Saudi Arabia as a “startup country,” adding that “Saudi has a founder; you don’t call him a founder, you call him his royal highness.” But Marc Andreessen has found another royal to admire. Since President Donald Trump’s November 2024 election victory, Andreessen has logged a lot of hours at Mar-a-Lago, by his own account, helping shape policy on tech, business, and economics. Early last year, he became an “unpaid intern” at Elon Musk’s Department of Government Efficiency, vetting candidates for the Trump administration — not just for tech roles but for positions in the Defense Department and intelligence agencies. Scott Kupor, a16z’s first employee back in 2009, was sworn in as director of the U.S. Office of Personnel Management this past summer. This matters because a16z’s current strategy is heavily weighted toward what it calls “American Dynamism” — a practice that invests in defense, aerospace, public safety, housing, education, and manufacturing. The portfolio aligns remarkably well with Defense Department priorities: Anduril (autonomous defense systems), Shield AI (military drones), Saronic Technologies (autonomous naval vessels), and Castelion (hypersonic missiles). The bigger bet is that America needs to reindustrialize and reshore critical manufacturing, particularly since, as a16z itself notes, the U.S. would exhaust its entire missile inventory “in something like 8 days” in a conflict with China over Taiwan, then need three years to rebuild it. Techcrunch event Join the Disrupt 2026 Waitlist Add yourself to the Disrupt 2026 waitlist to be first in line when Early Bird tickets drop. Past Disrupts have brought Google Cloud, Netflix, Microsoft, Box, Phia, a16z, ElevenLabs, Wayve, Hugging Face, Elad Gil, and Vinod Khosla to the stages — part of 250+ industry leaders driving 200+ sessions built to fuel your growth and sharpen your edge. Plus, meet the hundreds of startups innovating across every sector. Join the Disrupt 2026 Waitlist Add yourself to the Disrupt 2026 waitlist to be first in line when Early Bird tickets drop. Past Disrupts have brought Google Cloud, Netflix, Microsoft, Box, Phia, a16z, ElevenLabs, Wayve, Hugging Face, Elad Gil, and Vinod Khosla to the stages — part of 250+ industry leaders driving 200+ sessions built to fuel your growth and sharpen your edge. Plus, meet the hundreds of startups innovating across every sector. San Francisco | WAITLIST NOW Then there’s the AI bet, which might be the firm’s highest-risk, highest-reward play yet. a16z has positioned itself across every level of the AI stack: infrastructure (Databricks), foundation models (with stakes in Mistral AI, OpenAI and xAI), and applications (Character.AI, among many other portfolio companies). The firm has wins to point to. Its $25 million investment in Coinbase turned into an $86 billion valuation at the 2021 IPO. There’s Airbnb (public at over $100 billion), Slack (acquired for $27.7 billion), and GitHub ($7.5 billion to Microsoft). Its portfolio includes 115 unicorns, 35 IPOs, and 241 acquisitions, according to the market intelligence firm Tracxn. The firm has also made and lost money by snapping up cryptocurrency tokens, though there’s less visibility into those numbers. In a blog post published Friday morning, Horowitz writes that “as the American leader in Venture Capital, the fate of new technology in the United States rests partly on our shoulders.” It’s the kind of statement certain to cause agita at rival firms, some of which have been around closer to 50 years, compared with the much younger a16z. Horowitz frames a16z’s mission as “ensuring that America wins the next 100 years of technology.” Whether that happens remains to be seen. What’s certain is that Andreessen Horowitz has mastered the art of raising money — $15 billion this time — to fund a vision of American technological dominance that runs through Riyadh, Mar-a-Lago, and the Pentagon. That’s quite a pitch, and plainly, it works.","Fri, 09 Jan 2026 13:00:00 +0000",2026-01-10 20:45:02.418625
97,,,,,,,techcrunch,https://techcrunch.com/2026/01/09/anthropic-adds-allianz-to-growing-list-of-enterprise-wins/,Anthropic adds Allianz to growing list of enterprise wins,"AI research lab Anthropic continues to land sizable enterprise deals. Its latest entails bringing its large language models to a legacy German insurance giant. Anthropic on Friday announced a deal with Munich, Germany-based global insurance conglomerate Allianz to bring “responsible AI” to the insurance industry. The parties declined to share financial terms of the deal. The partnership is made up of three specific initiatives. The first is making Claude Code, Anthropic’s AI-powered coding tool, available to all of Allianz’s employees. Anthropic and Allianz will also build custom AI agents for Allianz employees that can execute multistep workflows with a human in the loop. This partnership also includes an AI system that logs all AI interactions to keep the AI transparent and ensure that information is readily available for regulatory or other needs. “With this partnership, Allianz is taking a decisive step to address critical AI challenges in insurance,” Oliver Bäte, CEO of Allianz SE, said in the company’s press release. “Anthropic’s focus on safety and transparency complements our strong dedication to customer excellence and stakeholder trust. Together, we are building solutions that prioritize what matters most to our customers while setting new standards for innovation and resilience.” This is just the latest enterprise deal Anthropic has landed in recent months. Techcrunch event Join the Disrupt 2026 Waitlist Add yourself to the Disrupt 2026 waitlist to be first in line when Early Bird tickets drop. Past Disrupts have brought Google Cloud, Netflix, Microsoft, Box, Phia, a16z, ElevenLabs, Wayve, Hugging Face, Elad Gil, and Vinod Khosla to the stages — part of 250+ industry leaders driving 200+ sessions built to fuel your growth and sharpen your edge. Plus, meet the hundreds of startups innovating across every sector. Join the Disrupt 2026 Waitlist Add yourself to the Disrupt 2026 waitlist to be first in line when Early Bird tickets drop. Past Disrupts have brought Google Cloud, Netflix, Microsoft, Box, Phia, a16z, ElevenLabs, Wayve, Hugging Face, Elad Gil, and Vinod Khosla to the stages — part of 250+ industry leaders driving 200+ sessions built to fuel your growth and sharpen your edge. Plus, meet the hundreds of startups innovating across every sector. San Francisco | WAITLIST NOW In December, the company inked a $200 million deal to bring its AI models to data cloud company Snowflake and its customers. Shortly after, it announced a multi-year partnership with the consulting firm Accenture. In October, it signed a deal with consulting firm Deloitte to bring its Claude chatbot to the firm’s 500,000 employees. That same month, Anthropic signed a deal with IBM to bring its AI models into the latter’s products. The race for AI enterprise dominance is clearly on, and Anthropic appears to be winning — so far at least. Anthropic holds 40% of enterprise AI market share, according to a December survey from Anthropic investor Menlo Ventures, and 54% of the market share for AI coding. Anthropic market share increased throughout last year. When Menlo’s original survey came out in July, the company held a 32% market share for overall enterprise LLM use. Google launched its dedicated enterprise AI product, Gemini Enterprise, in October. At the time, the company touted that the product suite already had customers, including fintech Klarna, design software company Figma, and cruise line operator Virgin Voyages, among others. OpenAI launched its enterprise version of ChatGPT, ChatGPT Enterprise, in 2023. Recently, the company reportedly expressed deep concern in an internal memo that Google Gemini’s success was starting to encroach on its business. Shortly after, the company released a report that said enterprise use of ChatGPT had surged 8x in the past year. A recent TechCrunch investor survey found that enterprise-focused VCs overwhelmingly think that 2026 will be the year that enterprises start to see a meaningful return on their investment into AI products. While Anthropic seems to be a clear favorite at the moment, this year will likely be telling of what the enterprise AI market — and its competitive landscape — will look like in the future.","Fri, 09 Jan 2026 09:00:00 +0000",2026-01-10 20:45:02.763342
98,,,,,,,techcrunch,https://techcrunch.com/video/inside-ces-2026s-physical-ai-takeover/,Inside CES 2026’s “physical AI” takeover,"Loading the player… After years of chatbots and image generators, AI is finally leaving the screen. At CES 2026, that shift became impossible to ignore. The annual tech showcase in Las Vegas was dominated by “physical AI” and robotics, from Boston Dynamic’s newly redesigned Atlas humanoid robot to AI-powered ice makers (yes, really). The companies in attendance clearly want consumers to know: AI isn’t just capable of answering questions anymore. It’s ready to movecar parts in factories, catchcatching drones with net guns, and dance in automaker booths. Watch as TechCrunch’s Equity podcast breaks down everything we saw at CES 2026 and more deals from the week that caught our eye.","Fri, 09 Jan 2026 01:19:00 +0000",2026-01-10 20:45:03.101299
99,,,,,,,techcrunch,https://techcrunch.com/2026/01/08/data-security-startup-cyera-hits-9b-valuation-six-months-after-being-valued-at-6b/,Data security startup Cyera hits $9B valuation six months after being valued at $6B,"In Brief Data security startup Cyera continues on a growth tear. On Thursday, it announced a $400 million Series F funding round at a $9 billion valuation. The New York-based outfit has now raised over $1.7 billion. This funding comes just six months after the previous $540 million round at a $6 billion valuation. The new round was led by funds managed by Blackstone with participation from existing investors including Accel, Coatue, Lightspeed, Redpoint, Sapphire, Sequoia, and others. Cyera offers what it calls data security posture management, a service that helps companies map out where all their sensitive data lives across cloud systems and databases, track how employees and applications use it, and identify security vulnerabilities. The rise of AI — which has increased both the volume of data that companies handle and concerns about data leaks — has helped Cyera sign up one-fifth of the Fortune 500 companies as customers and more than triple revenue in its last year, the company says, causing investors to eagerly pile in.","Thu, 08 Jan 2026 23:59:56 +0000",2026-01-10 20:45:03.396865
100,,,,,,,techcrunch,https://techcrunch.com/2026/01/08/governments-grapple-with-the-flood-of-non-consensual-nudity-on-x/,Governments grapple with the flood of non-consensual nudity on X,"For the past two weeks, X has been flooded with AI-manipulated nude images, created by the Grok AI chatbot. An alarming range of women have been affected by the non-consensual nudes, including prominent models and actresses, as well as news figures, crime victims, and even world leaders. A December 31 research paper from Copyleaks estimated roughly one image was being posted each minute, but later tests found far more. A sample gathered from January 5-6 found 6,700 per hour over the 24-hour period. But while public figures from around the world have decried the choice to release the model without safeguards, there are few clear mechanisms for regulators hoping to rein in Elon Musk’s new image-manipulating system. The result has become a painful lesson in the limits of tech regulation — and a forward-looking challenge for regulators hoping to make a mark. Unsurprisingly, the most aggressive action has come from the European Commission, which on Thursday ordered xAI to retain all documents related to its Grok chatbot. The move doesn’t necessarily mean the commission has opened up a new investigation, but it’s a common precursor to such action. It’s particularly ominous given recent reporting from CNN that suggests Elon Musk may have personally intervened to prevent safeguards from being placed on what images could be generated by Grok. It’s unclear whether X has made any technical changes to the Grok model, although the public media tab for Grok’s X account has been removed. In a statement, the company specifically denounced the use of AI tools to produce child sexual imagery. “Anyone using or prompting Grok to make illegal content will suffer the same consequences as if they upload illegal content,” the X Safety account posted on January 3, echoing a previous tweet by Elon Musk. In the meantime, regulators around the world have issued stern warnings. The United Kingdom’s Ofcom issued a statement on Monday, saying it was in touch with xAI and “will undertake a swift assessment to determine whether there are potential compliance issues that warrant investigation.” In a radio interview on Thursday, U.K. Prime Minister Keir Starmer called the phenomenon “disgraceful” and “disgusting,” saying “Ofcom has our full support to take action in relation to this.” In a post on LinkedIn, Australian eSafety Commissioner Julie Inman-Grant said her office had received a doubling in complaints related to Grok since late 2025. But Inman-Grant stopped short of taking action against xAI, saying only, “We will use the range of regulatory tools at our disposal to investigate and take appropriate action.” Techcrunch event Join the Disrupt 2026 Waitlist Add yourself to the Disrupt 2026 waitlist to be first in line when Early Bird tickets drop. Past Disrupts have brought Google Cloud, Netflix, Microsoft, Box, Phia, a16z, ElevenLabs, Wayve, Hugging Face, Elad Gil, and Vinod Khosla to the stages — part of 250+ industry leaders driving 200+ sessions built to fuel your growth and sharpen your edge. Plus, meet the hundreds of startups innovating across every sector. Join the Disrupt 2026 Waitlist Add yourself to the Disrupt 2026 waitlist to be first in line when Early Bird tickets drop. Past Disrupts have brought Google Cloud, Netflix, Microsoft, Box, Phia, a16z, ElevenLabs, Wayve, Hugging Face, Elad Gil, and Vinod Khosla to the stages — part of 250+ industry leaders driving 200+ sessions built to fuel your growth and sharpen your edge. Plus, meet the hundreds of startups innovating across every sector. San Francisco | WAITLIST NOW By far the largest market to threaten action is India, where Grok was the subject of a formal complaint from a member of Parliament. On January, India’s communications regulator MeitY ordered X to address the issue and submit an “action-taken” report within 72 hours — a deadline that was subsequently extended by 48 hours. While a report was submitted to the regulator on January 7, it’s unclear whether MeitY will be satisfied with the response. If not, X could lose its safe harbor status in India, a potentially serious limitation on its ability to operate within the country.","Thu, 08 Jan 2026 22:08:58 +0000",2026-01-10 20:45:03.712916
