,Unnamed: 0.5,Unnamed: 0.4,Unnamed: 0.3,Unnamed: 0.2,Unnamed: 0.1,Unnamed: 0,source,url,headline,text,published,collected_at
50,50.0,50.0,50.0,50.0,100.0,,wired,https://www.wired.com/story/bose-coupon-code/,The Best Bose Coupon Codes for January 2026,"If you hate hearing the sound of the world around you, Bose products are for you. And WIRED has Bose coupon codes to help you save. The brand pioneered active noise cancelling headphones, and has remained a pioneer in providing sonic peace to everyone that can afford the brand’s high-end products. Now you can get Bose discounts off some of our favorite speakers, soundbars, headphones, and other audio devices from the brand, including top picks like its wireless earbuds and over-ear noise canceling headphones. Bose Headphones, Earbuds, Soundbars and Speakers: Up to 40% Off Bose makes some of our favorite WIRED-tested headphones. And lucky for you, Bose is heavily discounting some of our favorite models. We at WIRED love open earbuds, and gave these a 7/10 rating because of their innovative, small, and comfy design. The Bose Ultra Open Earbuds are only $199 right now ($100 off) until January 4, 2026. Get $130 Off Bose QuietComfort Headphones The crowd-pleasing QuietComfort Ultra Earbuds (2nd Gen), are only $250 now (originally $299) until December 27. The OG Bose QuietComfort Ultra Headphones are now $299 (originally $429), that’s $130 off. Make sure you grab these deals before they’re gone. Get 10% Off Your First Purchase With a Bose Coupon Code The way it works is that you sign up with your email. The Bose coupon will be sent within 30 minutes, and it can be used for a maximum discount of $100. Other exclusions may apply. Please see email for full terms and conditions of this offer. It expires December 31, 2025 so you can use the Bose promo code until the end of the year. Bose Education Discount for Students and Teachers If you’re a teacher or going to school, you’re also likely able to get another discount from the MIT-owned brand. Eligible students and teachers can claim $30 off on Bose orders over $199, you just need to verify your status via ID.me. This is a great way to snag a discounted pair of headphones for working in your school library, or working out in the gym after work as a professor. $30 First Responder and Healthcare Discount at Bose Veterans and active military personnel, nurses, medical personnel, hospital employees, and other first responders can claim $30 off on Bose orders over $199. They also just need to verify their status via ID.me. Become a My Bose Member for More Benefits When you buy from Bose.com, you have the option to create a My Bose account where you can easily manage orders, register products, view your warranty status, and enjoy exclusive offers just for My Bose members. If you like the brand and plan to continue to buy its products, it might be worth it to sign up. The Best Sales to Save on Bose Products Check back often to snag rotating Bose coupon codes and deals. Otherwise, the best times to buy Bose products are when major sales days are running. You can find discounts during Black Friday, Cyber Monday, Prime Day, and more.","Sun, 04 Jan 2026 06:00:00 +0000",2026-01-05 14:48:23.530487
51,51.0,51.0,51.0,51.0,101.0,,wired,https://www.wired.com/story/sephora-promo-code/,Sephora Promo Codes for December 2025,"If you’ve ever shopped for a beauty product, you’ve probably heard of Sephora. The brand is known for its excellent rewards program, free birthday gifts, free samples, generous return policy, and a giant variety of shades and products for everybody. Splurging on makeup, skincare, and haircare products can be expensive, but a Sephora promo code makes it easier to treat yourself to a big black-and-white striped bag of beauty products. How to Use a Sephora Coupon While you don’t need to be a Beauty Insider to use every Sephora promo code, it’s definitely worth it if you sign up. You’ll earn points with nearly every purchase, plus you’ll get free shipping and a free birthday gift each year (like the heavily sought-after Dior perfume set of years past). There are member-exclusive sales and deals too. Once you’re signed up, you’ll be able to use coupons that are specifically for members, like those available during the Sephora Savings Event that takes place each November. Our Top Beauty Picks to Get With Your Sephora Discount Code Sephora sells most of our favorite hair straighteners, curling irons, and hair dryers. I also love Sephora’s gift sets, which are great for holiday gifts but also fantastic ways to treat yourself to something special. Sephora doesn’t only have great makeup, but beauty tech like PMD Clean Pro facial cleansing brushes or super trendy LED Light Therapy Devices to level up your beauty regimen. Microcurrent Devices like NuFace Trinity, Cryotherapy Tools like BeautyBio Cryo Skin Ice Rollers, or exfoliating Tools like dermaplaners are great beauty-tech gift ideas for others or yourself. Sephora has a wide selection of brands to choose from that you’ve probably seen on TikTok or Instagram. Some highlights include Drunk Elephant, Tatcha, and Fenty Beauty.","Sun, 04 Jan 2026 06:00:00 +0000",2026-01-05 14:48:23.948540
52,52.0,52.0,52.0,52.0,102.0,,wired,https://www.wired.com/story/what-happens-next-in-venezuela-and-the-rest-of-latin-america/,What Happens Next in Venezuela—and the Rest of Latin America?,"Venezuela will remain under US control following the arrest of Nicolás Maduro. That was Donald Trump's message during a press conference held at his Mar-a-Lago compound after US forces launched an offensive against various military targets in Venezuela early Saturday morning. The operation culminated in Maduro's capture. In the briefing, Trump stressed that his administration will not allow someone “that does not have the good of the Venezuelan people in mind” to take control of the country. “We have had decades of that. We are not going to let that happen,” he said. “We are going to run the country until such time as we can do a safe, proper, and judicious transition.” Trump explained that the leadership of Venezuela will be in the hands of high-ranking US officials, including secretary of state Marco Rubio and secretary of defense Pete Hegseth. At the same time, María Corina Machado, considered the main leader of the opposition to Maduro and Hugo Chávez and recent winner of the Nobel Peace Prize, issued a statement in which she said that opposition party figure Edmundo González Urrutia must immediately assume the presidency of the country. “This is the time of the citizens. Of those of us who risked everything for democracy on July 28 [2024, the date of the last Venezuelan presidential election]. Of those of us who elected Edmundo González Urrutia as the legitimate president of Venezuela, who must immediately assume his constitutional mandate and be recognized as Commander in Chief of the National Armed Forces by all the officers and soldiers who are part of it. Today we are prepared to enforce our mandate and take power,” the statement says. The text was republished by Gonzalez Urrutia himself, who made a direct appeal to the Venezuelan population: “Venezuelans, these are decisive hours. Know that we are ready for the great operation of reconstruction of our nation.” Trump appears to have other ideas. At Saturday's press conference, he indicated that his administration has plans to rebuild the Venezuelan oil infrastructure and recover the oil that, according to the president, was “stolen” from the United States several decades ago. “Venezuela unilaterally seized and sold American oil, American assets, and American platforms, costing us billions and billions of dollars,” Trump claimed. “We are going to have our very large United States oil companies, the biggest anywhere in the world, spend billions of dollars, fix the badly broken infrastructure … and start making money for the country.”","Sat, 03 Jan 2026 22:10:35 +0000",2026-01-05 14:48:24.420796
53,53.0,53.0,53.0,53.0,103.0,,wired,https://www.wired.com/story/disinformation-floods-social-media-after-nicolas-maduros-capture/,Disinformation Floods Social Media After Nicolás Maduro’s Capture,"Within minutes of Donald Trump announcing in the early hours of Saturday morning that US troops had captured Venezuelan president Nicolás Maduro and his wife, Cilia Flores, disinformation about the operation flooded social media. Some people shared old videos across social platforms, falsely claiming that they showed the attacks on the Venezuelan capital Caracas. On TikTok, Instagram, and X, people shared AI-generated images and videos that claimed to show US Drug Enforcement Administration agents and various law enforcement personnel arresting Maduro. In recent years, major global incidents have triggered huge amounts of disinformation on social media as tech companies have pulled back efforts to moderate their platforms. Many accounts have sought to take advantage of these lax rules to boost engagement and gain followers. “The United States of America has successfully carried out a large scale strike against Venezuela and its leader, President Nicolas Maduro, who has been, along with his wife, captured and flown out of the Country,” Trump wrote in a Truth Social post in the early hours of Saturday morning. Hours later, US attorney general Pam Bondi announced that Maduro and his wife had been indicted in the Southern District of New York and charged with narco-terrorism conspiracy, cocaine importation conspiracy, possession of machine guns and destructive devices, and conspiracy to possess machine guns and destructive devices. “They will soon face the full wrath of American justice on American soil in American courts,” Bondi wrote on X. Within minutes of the news of Maduro’s arrest breaking, an image claiming to show two DEA agents flanking the Venezuelan president spread widely on multiple platforms. However, using SynthID, a technology developed by Google DeepMind that claims to identify AI-generated images, WIRED was able to confirm it was likely fake. “Based on my analysis, most or all of this image was generated or edited using Google AI,” Google’s Gemini chatbot wrote after anaylzing the image being shared online. “I detected a SynthID watermark, which is an invisible digital signal embedded by Google's AI tools during the creation or editing process. This technology is designed to remain detectable even when images are modified, such as through cropping or compression.” The fake image was first reported by fact-checker David Puente. While X’s AI chatbot Grok also confirmed that the image was fake when asked by several X users, it falsely claimed that the image was an altered version of the arrest of Mexican drug boss Dámaso López Núñez in 2017.","Sat, 03 Jan 2026 18:14:47 +0000",2026-01-05 14:48:24.831625
54,54.0,54.0,54.0,54.0,104.0,,wired,https://www.wired.com/story/us-invaded-venezuela-and-captured-nicolas-maduro-chatgpt-disagrees/,The US Invaded Venezuela and Captured Nicolás Maduro. ChatGPT Disagrees,"At around 2 am local time in Caracas, Venezuela, US helicopters flew overhead while explosions resounded below. A few hours later, US president Donald Trump posted on his Truth Social platform that Venezuelan president Nicolás Maduro and his wife had been “captured and flown out of the Country.” US attorney general Pam Bondi followed with a post on X that Maduro and his wife had been indicted in the Southern District of New York and would “soon face the full wrath of American justice on American soil in American courts.” It has been a stunning series of events, with unknown repercussions for the global world order. If you asked ChatGPT about it this morning, it told you that you’re making it up. WIRED asked leading chatbots ChatGPT, Claude, and Gemini the same question a little before 9 am ET. In all cases, we used the free, default version of the service, since that’s what the majority of users experience. We also asked AI search platform Perplexity, which advertises “accurate, trusted, and real-time answers to any question.” (While Perplexity Pro users have access to a wide range of third-party AI models, the default, free search experience routes users to different models based on a variety of factors.) The question was: Why did the United States invade Venezuela and capture its leader Nicolás Maduro? The responses were decidedly mixed. Credit to Anthropic and Google, whose respective Claude Sonnet 4.5 and Gemini 3 models gave timely responses. Gemini confirmed that the attack had taken place, gave context around the US claims of “narcoterrorism” and US military buildup in the region prior to the attack, and acknowledged the Venezuela government’s position that all of this is pretext for accessing Venezuela’s significant oil and mineral reserves. It cited 15 sources along the way, ranging from Wikipedia to The Guardian to the Council on Foreign Relations. Claude initially balked. “I don't have any information about the United States invading Venezuela or capturing Nicolás Maduro. This hasn't happened as of my knowledge cutoff in January 2025,” it responded. It then took an important next step: “Let me search for current information about Venezuela and Maduro to see if there have been any recent developments.” The chatbot then listed 10 news sources—including NBC News but also Breitbart—and gave a brisk four-paragraph summary of the morning’s events, providing a link to a new source after nearly every sentence.","Sat, 03 Jan 2026 16:03:15 +0000",2026-01-05 14:48:25.266281
55,55.0,55.0,55.0,55.0,105.0,,wired,https://www.wired.com/review/framework-laptop-16/,Framework Laptop 16 (RTX 5070) Review: A Dream Come True,"Between that and the potential $300 CPU upgrade you'll want to get—the AMD Ryzen 9 HX 370—the laptop will start at $2,449, and it'll only go up once you add other components like memory and storage. To put things in perspective, the extremely high-end Razer Blade 16 with the RTX 5070 is around $2,300 (though it frequently dips on sale below $2,000). With the Framework Laptop 16, you're paying extra for the ability to swap out parts in the future. Game 2560 x 1600 1920 x 1200 Cyberpunk 2077 56 fps 93 fps Black Myth: Wukong 27 fps 37 fps Marvel Rivals 40 fps 56 fps Monster Hunter Wilds 46 fps 60 fps Fortunately, what you get in return is solid gaming performance. It's good enough to give you an option of playing in native resolution in some games, such as Cyberpunk 2077. The frame rates you see above were all tested at the highest graphics preset without enabling upscaling or ray tracing, so you can get higher frame rates by dropping the settings. I like that there's enough performance to let gamers choose smoother gameplay or sharper visuals depending on the game and the style of play. Of the games I tested, Black Myth: Wukong was the only title that couldn't run smoothly at the max graphics settings. The RTX 5070 only has 8 GB of VRAM, which is its biggest deficiency in AAA titles, unlike the desktop GPU of the same name, which has 12 GB. The trade-off in adding a discrete graphics card is in battery life, though it's not as bad as you might think. Despite having just as powerful graphics, the Framework Laptop 16 still nets around 25 percent more battery life than the cheaper gaming laptops out there. In my testing, it lasted for close to nine hours in local video playback. That will equate to much less in a real-life workload—I was getting closer to five hours in my typical daily work. One unique benefit of the system is that you can always remove the graphics module if you want to get a few more hours of battery life while traveling, and you don't plan to play games. One of the impressive things about the Framework Laptop 16 is that it runs entirely off USB-C power. The 240-watt GaN power charger is no bigger than a standard charger, yet it can power the entire system, graphics included. Just make sure to actually use both sides of the included charger to get the full performance. The Framework laptops were conceived and designed before the recent changes in laptop pricing. You can now buy a really great laptop for $650—even less during big sales events. Unfortunately, Framework's pricing doesn't tend to change, and the company doesn't sell through third-party retailers. But there's an audience for a repairable, sustainable, and now more powerful laptop—whether you want it to run Linux or Windows. Just be ready to pay a premium.","Sat, 03 Jan 2026 13:00:00 +0000",2026-01-05 14:48:25.714502
56,56.0,56.0,56.0,56.0,106.0,,wired,https://www.wired.com/story/handy-free-speech-to-text-app/,"Stop Using Your Keyboard and Start Using This Simple, Free Speech-to-Text App","If old sci-fi shows are anything to go by, we're all using our computers wrong. We're still typing with our fingers, like cave people, instead of talking out loud the way the future was supposed to be. Have you ever seen Picard touch a keyboard? Of course not. And it's odd because our computers are all capable of turning speech into text by default. The problem? It just doesn't work very well. Or, at least, it didn't. In recent years AI models like Nvidia's Parakeet and OpenAI's Whisper, both open source, have made great strides in turning human voices into text. Both excel at correctly adding things like punctuation and capitalization, and you can run them right on your computer. Using these models is the closest I've felt to recording a captain's log—it just works. The problem? They're both a little complicated to set up. That's where Handy comes in. This is a dead-simple, totally free application that can set up either of these models on your computer and give you a keyboard shortcut to use it. It was created by CJ Pais after he broke his finger, rendering him unable to type. He wanted a totally free, and radically simple, way to use existing AI speech-to-text tools. To get started simply download Handy—there are versions offered for Windows, macOS, and Linux. Run the application and you'll be asked which model you want to use.","Sat, 03 Jan 2026 12:00:00 +0000",2026-01-05 14:48:26.159446
57,57.0,57.0,57.0,57.0,107.0,,wired,https://www.wired.com/story/oura-whoop-blood-labs/,Blood Feud: Oura’s Health Panels Versus Whoop’s Advanced Labs,"Hey, Theranos? Ever heard of it? Erstwhile founder and current felon Elizabeth Holmes may have drastically overstated her claims by saying you could take a bunch of affordable health tests with one drop of blood, but the company was trying to address a real problem. Many people get a panel of blood tests as part of their routine wellness check, and they’re not fun at all. Blood tests are inconvenient to schedule. You have to fast for at least eight hours beforehand for many of them, and it’s hell if you’re scared of needles. This year, fitness tracker companies like Oura and Whoop began offering blood panels as part of their subscription services, albeit with an additional surcharge. Ultrahuman also offers a blood panel called Blood Vision, which we have not yet tested because the Ultrahuman ring is no longer sold in the United States. It’s also worth noting that both of these tests are available only in the United States as of the time of this writing and exclude Arizona, Hawaii, North Dakota, South Dakota, and Wyoming, which have stricter laws restricting direct access testing without a physician’s order. I booked through the respective apps, starved myself (OK, didn’t eat or drink caffeine for eight hours) for multiple test dates, and had my blood drawn for 11 total vials at the same Quest Diagnostics, where the technicians probably decided I had some weird Twilight fetish. (Disclosure: Both Oura and Whoop covered the out-of-pocket cost for me, and both the devices and the tests are HSA- and FSA-eligible.) I compared these labs to others I had done with my doctor. Here’s what I discovered. Print It Out The first thing you’ll notice when you take a consumer blood panel instead of through your doctor is that, well, you have to book the tests through that company's app. Both Oura and Whoop bill this as a more convenient feature, but if you already have a primary care doctor, it's not. (I realize that having a primary care doctor in this country is already a fairly big hurdle.) My doctor orders labs for my annual exam; I just walk down the hall and get them done as part of my yearly checkup. I booked my Health Panels test through Oura, but after not eating all morning and waiting for 15 minutes in a small, grim room in the back of a Safeway, the lab technician told me she could not find my lab order. I suggest downloading your lab order from the company as a PDF, printing it out, and bringing that hard copy to your appointment. For my yearly checkup, given my general state of health, my primary care doctor ordered a basic blood panel with three tests comprising 20 biomarkers—that’s a complete blood count, A1C to check for diabetes, and a lipid profile, which includes your cholesterol levels and indicates your future likelihood of heart disease. Oura’s test cost $99, and the comprehensive panel measures 50 biomarkers—more than twice what my doctor ordered. In addition to the lipid panels, blood count, and A1C, it includes other panels like blood glucose, insulin, potassium, sodium, total protein, and triglycerides. These results took longer to come back than I expected. The first set of results came in after 24 hours, but it took almost two weeks to get my full results and doctor-interpreted report. While most of my results were optimal, there was an alarming one: My blood test for lipoprotein (a) came back at 214 nanomoles per liter (nmol/L). (The normal range is <30 nmol/L.) This indicates a seriously elevated inherited genetic risk for cardiovascular disease, like heart attacks or stroke, that is largely not affected by diet, exercise, or lifestyle. Add It Up Whoop’s test, in comparison, starts at $349 for two per year, and unlike with Oura, you can upload tests done through your doctor’s office to the Whoop app for free. Whoop’s Advanced Labs costs more because it offers 65 biomarkers instead of 50, and some of these tests are extremely expensive, like a vitamin D test and various hormone tests. Again, most of my results, even the hormone ones, came back as being optimal. Whoop did catch a few items that Oura missed, like being very low in iron and vitamin D. That's an easy, actionable fix with a daily multivitamin, and I'm glad Whoop caught it.","Sat, 03 Jan 2026 11:09:00 +0000",2026-01-05 14:48:26.664104
58,58.0,58.0,58.0,58.0,108.0,,wired,https://www.wired.com/story/how-to-manage-files-on-ios-and-android/,How to Manage Files on iOS and Android,"One of the changes that we've seen in phones over recent years has been more control over the file systems. Having previously hidden away a lot of the local storage structure, Android and iOS now both give you easy access to it so you can manage your files similar to how you would on Windows or macOS. It reflects a few gradual changes in the phones that we carry around with us, including increasing amounts of onboard storage space, increasingly complex apps, and increasingly sophisticated operating systems. Links with cloud storage platforms are also now more common than ever, which adds to the need for local file management tools. While there are several file managers to use, particularly on Android, we're going to focus on the tools that come built into Android and iOS, and what you can do with them. Besides giving you a better idea of what files you've got and where they are, these apps will also help you free up space on your devices. Files on Android Files on Android lets you browse folders in a number of ways. David Nield If you own an Android phone of some description, you'll find the Files app from Google is preinstalled. Open the app and you should see recently saved files first, then different file categories that you can browse through, including Downloads, Images, Videos, and Documents. You can also search for files using the box at the top. Farther down the screen, you can access every folder on your file via the Internal storage button and every cloud storage account you've connected to Android via the Other storage button. There's also access to your Safe folder here, which is a special folder you can protect with a PIN and use to store particularly sensitive files. Once you're within a specific folder or file category, you're able to tap on any file to open it—for formats that cannot be opened within the Files app itself, you'll be prompted to choose a different app on your phone to handle it. Tap the grid or list icon in the top right corner to change the folder view, and the three dots (also top right), then Sort by to change the order in which files are shown. New folders can be added from the same menu.","Sat, 03 Jan 2026 11:00:00 +0000",2026-01-05 14:48:27.111591
