,Unnamed: 0.5,Unnamed: 0.4,Unnamed: 0.3,Unnamed: 0.2,Unnamed: 0.1,Unnamed: 0,source,url,headline,text,published,collected_at
0,0.0,0.0,0.0,0.0,0.0,0.0,techcrunch,https://techcrunch.com/2026/01/05/google-previews-new-gemini-features-for-tv-at-ces-2026/,Google previews new Gemini features for TV at CES 2026,"Google believes AI can improve the TV-watching experience, which is why it brought its Gemini AI to Google TV devices in November. At the Consumer Electronics Show (CES 2026) in Las Vegas, the company is now showing off a series of new Gemini features that will soon arrive on the TV, making it possible for viewers to deep dive into topics, search for and “reimagine” their personal photos and videos with AI, and, perhaps best of all, tell the TV what to do instead of having to navigate through complicated settings. The company is first bringing these Gemini features and others to select TCL televisions before rolling them out more broadly to other Google TV devices in the months ahead. Designed for large-screen experiences, Gemini for Google TV will allow users to talk to their TV to find something to watch, catch up on a favorite series by getting a recap of the plot, or get recommendations, all by using natural language conversation. For instance, you could ask Gemini for something to watch that would be a blend of two people’s tastes, or get help remembering a show or movie where you can’t remember the title, but can describe the plot or name one of the actors. You could even ask Google something like, “What’s the new hospital drama everyone’s talking about?” Image Credits:Google Gemini can respond to users’ questions through a new visually rich framework that adapts to individual queries, combining text, imagery, video context, and real-time sports updates, as required. But Google sees the potential for the TV’s screen to be used for more than just entertainment; with Gemini, the TV can be used to educate, too. At CES, Google showed how this would work. When users ask a question about something they want to learn about, the TV screen can offer a deep dive into the topic. A narrated interactive overview simplifies concepts, and users can ask follow-up questions to learn more. Image Credits:Google Gemini will also allow users to query their Google Photos library for specific people or moments. They can also apply artistic styles to their photos and videos using Gemini AI and turn their memories into cinematic slideshows, says Google. Image Credits:Google Image Credits:Google However, perhaps the most useful feature is one that gives you the power to optimize the TV’s settings using only your voice. Now, you’ll be able to tell Gemini things like “the screen is too dim” or “I can’t hear the dialogue,” and Gemini will adjust the relevant settings without you having to leave the movie or TV show you’re watching to dig through menus to find the necessary option. Image Credits:Google Google says the new Gemini features will require the Google TV devices to be running Android TV OS 14 or higher, and they will need an internet connection. Not all languages, countries, or devices will be supported at launch, and users must also have a Google account to access the Gemini for TV experience.","Mon, 05 Jan 2026 14:00:00 +0000",2026-01-05 14:42:59.284711
1,1.0,1.0,1.0,1.0,1.0,1.0,techcrunch,https://techcrunch.com/2026/01/05/lgs-new-oled-tv-is-just-9mm-thick/,LG’s new OLED TV is just 9mm thick,"In Brief A significant portion of the annual Consumer Electronics Show (CES) is about TVs, and this year, LG is showing off its manufacturing chops with a new Wallpaper OLED TV that is just 9mm thick. The South Korean company first launched the Wallpaper line in 2017, and is now bringing it back with this model, dubbed OLED evo W6. The company says you can connect the TV to its Zero Connect Box wirelessly to stream lossless 4K video and audio, provided the box is within 10 meters of the TV. LG claims the TV improves on brightness, color and blacks compared to its predecessor, and is certified “reflection-free” by product testing group Intertek. The display has a refresh rate maxing out at 165Hz, and supports AMD’s FreeSync Premium tech. LG didn’t provide any pricing details, but it said that the W6 will be available in 77 and 83-inch sizes.","Mon, 05 Jan 2026 12:13:11 +0000",2026-01-05 14:42:59.721040
2,2.0,2.0,2.0,2.0,2.0,2.0,techcrunch,https://techcrunch.com/2026/01/05/luminar-claims-founder-austin-russell-is-dodging-a-subpoena-in-the-bankruptcy-case/,Luminar claims founder Austin Russell is dodging a subpoena in the bankruptcy case,"Lidar-maker Luminar says its founder and former CEO Austin Russell has been evading requests for information — including a subpoena — that the company needs in order to decide whether it should take legal action against him. The company, which entered the Chapter 11 bankruptcy process in late December, said in an emergency filing over the weekend that it has been trying to reclaim company-owned devices from Russell since his resignation in May. While it has recovered six computers, Luminar is still seeking Russell’s company-issued phone and a digital copy of his personal phone. Luminar’s lawyers also wrote in the filing that Russell and his own personal employees repeatedly misled legal representatives about the founder’s location over the holidays. They’re asking the court for permission to instead serve Russell by mail or email. A lawyer for Luminar declined to comment further. In emails attached to the filing, Russell claimed he was being cooperative and has been trying to get assurances from Luminar that any personal data from his devices will be protected. “The company declined, so we will follow the court-established process for data handling protections instead,” Leonard Shulman, an attorney for Russell, told TechCrunch in a statement. The emergency filing is one of the first major twists in a fast-moving bankruptcy case that involves Luminar trying to sell the two main parts of its business. The company is seeking court approval of an already-reached agreement to sell its semiconductor subsidiary to a company called Quantum Computing, Inc., and has established a January 9 deadline for bids on its lidar division. Russell, through his new venture Russell AI Labs, tried to buy Luminar before the Chapter 11 filing and has expressed plans to make a bid in the bankruptcy process. “As it relates to Luminar, our focus remains on what matters: Russell AI Labs’ bid to rebuild the company and bring value to its stakeholders,” Shulman said. Techcrunch event Join the Disrupt 2026 Waitlist Add yourself to the Disrupt 2026 waitlist to be first in line when Early Bird tickets drop. Past Disrupts have brought Google Cloud, Netflix, Microsoft, Box, Phia, a16z, ElevenLabs, Wayve, Hugging Face, Elad Gil, and Vinod Khosla to the stages — part of 250+ industry leaders driving 200+ sessions built to fuel your growth and sharpen your edge. Plus, meet the hundreds of startups innovating across every sector. Join the Disrupt 2026 Waitlist Add yourself to the Disrupt 2026 waitlist to be first in line when Early Bird tickets drop. Past Disrupts have brought Google Cloud, Netflix, Microsoft, Box, Phia, a16z, ElevenLabs, Wayve, Hugging Face, Elad Gil, and Vinod Khosla to the stages — part of 250+ industry leaders driving 200+ sessions built to fuel your growth and sharpen your edge. Plus, meet the hundreds of startups innovating across every sector. San Francisco | WAITLIST NOW Lawyers for Luminar said in the filing that it began hunting for information from Russell in May, just after he abruptly resigned following a “code of business conduct and ethics inquiry” performed by the board’s audit committee. The company was evaluating whether it may have potential legal claims against him “relating to the Audit Committee inquiry and personal loans taken by Mr. Russell,” according to the filing. But Luminar said those efforts were unsuccessful and Russell was not cooperative. On November 12, Luminar’s board of directors established a Special Investigation Committee and hired law firm Weil, Gotshal & Manges to further investigate “certain acts, omissions, transactions and potential claims and causes of action involving or related to certain current and former directors and officers of Luminar.” One month later, just before the bankruptcy, lawyers for Weil contacted the law firm of McDermott Will & Schulte, which had previously represented Russell. The Weil lawyers asked about collecting Russell’s Luminar-provided laptop and desktop computers, along with his company-issued phone and a digital copy (or “image”) of his personal phone. The lawyers from Weil spent a week trying to confirm whether McDermott would represent Russell in the matter of the Special Investigation Committee, only to find out on December 19 that it would not. The Weil lawyers tried contacting Russell directly instead. Russell responded for the first time on Christmas Eve, according to the filing. He eventually authorized McDermott to turn over the computers (which the firm had kept in its possession since his resignation), but the founder repeatedly asked for guarantees that Luminar’s lawyers would not search through personal data on his phones, emails attached to the emergency filing show. “I have offered direct cooperation as well as prompt action, even through the holidays – but if this singular basic protection cannot be confirmed, I am advised further deliberations on this matter will not be productive,” Russell wrote in an email on New Year’s Eve. Representatives for Luminar arranged to have a forensic examiner appear at Russell’s mansion in Florida on New Year’s Day. But the technician was turned away by Russell’s security team, which a lawyer for Luminar called “unacceptable.” Russell claimed the technician was sent to his home “unannounced” on the holiday morning “when I was asleep,” and reiterated his desire to protect the privacy of his personal data. A lawyer for Luminar responded that they had “repeatedly confirmed that we have no intention of looking at any documents beyond those that are Luminar-related.” Russell replied on January 2 that “[a]ny characterization that I have been uncooperative is wholly inaccurate” and accused the lawyers of “word gymnastics.” Luminar’s lawyers tried instead to subpoena this information from Russell but claim their process servers were similarly turned away by his security team. They also claim those security team members lied about Russell’s presence at his Florida residence. “Can we try to serve Austin again today? We’re going to need someone dogged. He is going to evade service as long as possible,” one of the Weil lawyers wrote in an email on New Year’s Eve. “In fact, he was home when your person tried last time and the guard simply lied for him.”","Mon, 05 Jan 2026 12:10:00 +0000",2026-01-05 14:43:00.194361
3,3.0,3.0,3.0,3.0,3.0,3.0,techcrunch,https://techcrunch.com/2026/01/05/teradar-reveals-its-first-terahertz-band-vision-sensor-for-cars/,Teradar reveals its first terahertz-band vision sensor for cars,"Two months after coming out of stealth with a $150 million fundraise, Boston-based Teradar is showing off its first flagship terahertz sensor at Consumer Electronics Show 2026 this week. The company is positioning the sensor, called Summit, as the first long-range, high-resolution sensor of its kind “designed for high performance in any type of weather, filling a critical gap left by legacy radar and lidar sensors.” The sensor will start shipping until 2028 if Teradar can lock down contracts with automakers. If that happens, the company expects the Summit will help enable those companies to add partial, or even full, autonomy features to their vehicles. Teradar’s whole approach is about leveraging the relatively-unused terahertz band of the electromagnetic spectrum between microwaves and infrared. And it’s a solid-state sensor, meaning there are no moving parts. All this is meant to give Teradar’s sensor the best qualities of lidar and radar sensors, with few of the drawbacks. It’s a potentially attractive proposition for automakers who might wince at the cost of lidars or the limitations of radars. Teradar says it’s already working to prove its tech with five top automakers from the U.S. and Europe, and three Tier 1 suppliers. Teradar’s impending entry into the market comes at a pivotal moment for automotive sensor suppliers. Leading U.S. lidar company Luminar just filed for bankruptcy protection in December after contracts with Volvo and Mercedes-Benz fell apart, as the automakers backed away from the tech. Those deals also crumbled partly because of low-cost competition from China, according to Luminar. Lidar adoption has been strong in China’s auto market and shows little sign of slowing up. In October, Chinese lidar company Hesai said it had built more than 1 million lidar sensors in 2025. Other U.S. companies in the space, like Ouster (acquired and merged with rival Velodyne after a wave of consolidation) have diversified into potential markets like robotics and smart infrastructure. Techcrunch event Join the Disrupt 2026 Waitlist Add yourself to the Disrupt 2026 waitlist to be first in line when Early Bird tickets drop. Past Disrupts have brought Google Cloud, Netflix, Microsoft, Box, Phia, a16z, ElevenLabs, Wayve, Hugging Face, Elad Gil, and Vinod Khosla to the stages — part of 250+ industry leaders driving 200+ sessions built to fuel your growth and sharpen your edge. Plus, meet the hundreds of startups innovating across every sector. Join the Disrupt 2026 Waitlist Add yourself to the Disrupt 2026 waitlist to be first in line when Early Bird tickets drop. Past Disrupts have brought Google Cloud, Netflix, Microsoft, Box, Phia, a16z, ElevenLabs, Wayve, Hugging Face, Elad Gil, and Vinod Khosla to the stages — part of 250+ industry leaders driving 200+ sessions built to fuel your growth and sharpen your edge. Plus, meet the hundreds of startups innovating across every sector. San Francisco | WAITLIST NOW Teradar is looking beyond automotive, too, and that vision was reflected in its recent raise. The $150 million Series B included funding from Lockheed Martin’s venture arm, and VXI Capital, a new defense-focused fund led by the former CTO of the U.S. military’s Defense Innovation Unit. Lidar isn’t completely dead in the auto industry, however. Rivian in December said it would integrate a roof-mounted lidar sensor (from an unnamed supplier) in its upcoming R2 SUV, signaling that there is still an appetite for using advanced sensor technology to bring autonomy to passenger vehicles, especially if it’s affordable. Teradar CEO Matt Carey told TechCrunch in November that he believes his terahertz sensor can meet all those marks, and sounded eager to pounce on the opportunity. “Our main job is to make sure our sensor gets on all automobiles, and whatever the best way to do that is, that’s what we’re going to pursue,” he said.","Mon, 05 Jan 2026 12:00:00 +0000",2026-01-05 14:43:00.835941
4,4.0,4.0,4.0,4.0,4.0,4.0,techcrunch,https://techcrunch.com/2026/01/05/kodiak-taps-bosch-to-scale-its-self-driving-truck-tech/,Kodiak taps Bosch to scale its self-driving truck tech,"Self-driving trucks company Kodiak AI announced on Monday it is working with global automotive supplier Bosch to develop a system of hardware and software that can give standard big rigs autonomous driving capabilities. The collaboration was announced at the 2026 Consumer Electronics Show in Las Vegas, and it could help Kodiak bring its self-driving tech to more trucks, faster. Kodiak, which is developing self-driving trucks for highway, industrial, and defense uses, has already developed and designed a self-driving system with redundant systems for braking, steering, sensors, and computers. In January 2025, Kodiak’s self-driving trucks began making driverless deliveries for Atlas Energy Solutions in the oil-rich Permian Basin of West Texas and eastern New Mexico. Kodiak has since delivered at least eight self-driving trucks to Atlas Energy as part of an initial 100-truck order under an agreement between the two companies. Kodiak has been working with Roush Industries, which was the upfitter for its driverless trucks delivered to Atlas. Now, the company, which went public via a merger with special-purpose acquisition company Ares Acquisition Corporation II in September 2025, wants to scale its tech for the truck masses. Bosch and Kodiak will work together on redundant platforms designed to turn semi trucks — regardless of manufacturer — into driverless ones. Bosch will supply Kodiak with a variety of hardware components, including sensors and vehicle actuation components such as steering technologies. Notably, these systems can be added within the vehicle production line or by a third-party upfitter at a later date, according to Kodiak founder and CEO Don Burnette. “We believe collaborating with Bosch will allow us to scale autonomous driving hardware with the modularity, serviceability, and system-level integration needed for commercial success for both upfit and factory-line integration,” Burnette said in a statement. Techcrunch event Join the Disrupt 2026 Waitlist Add yourself to the Disrupt 2026 waitlist to be first in line when Early Bird tickets drop. Past Disrupts have brought Google Cloud, Netflix, Microsoft, Box, Phia, a16z, ElevenLabs, Wayve, Hugging Face, Elad Gil, and Vinod Khosla to the stages — part of 250+ industry leaders driving 200+ sessions built to fuel your growth and sharpen your edge. Plus, meet the hundreds of startups innovating across every sector. Join the Disrupt 2026 Waitlist Add yourself to the Disrupt 2026 waitlist to be first in line when Early Bird tickets drop. Past Disrupts have brought Google Cloud, Netflix, Microsoft, Box, Phia, a16z, ElevenLabs, Wayve, Hugging Face, Elad Gil, and Vinod Khosla to the stages — part of 250+ industry leaders driving 200+ sessions built to fuel your growth and sharpen your edge. Plus, meet the hundreds of startups innovating across every sector. San Francisco | WAITLIST NOW Paul Thomas, who is president of Bosch in North America and the company’s Bosch Mobility Americas division, appears to see this as opportunity for growth in the sector. “By supplying production-grade hardware, we are enabling the next generation of autonomous trucking alongside Kodiak,” said Thomas in a statement. “Kodiak has already deployed trucks with no humans on board in commercial operation and this cooperation gives us a valuable opportunity to deepen our understanding of real-world autonomous vehicle requirements and to further enhance our offerings for the broader autonomous mobility ecosystem.” While Kodiak’s plan is to scale and Bosch is keen to increase its market share in the sector, it’s unclear exactly when this will happen. Neither company provided a timeline for when these new systems might go into production or become available.","Mon, 05 Jan 2026 10:00:00 +0000",2026-01-05 14:43:01.248184
