,Unnamed: 0.5,Unnamed: 0.4,Unnamed: 0.3,Unnamed: 0.2,Unnamed: 0.1,Unnamed: 0,source,url,headline,text,published,collected_at
128,,,,,,,wired,https://www.wired.com/story/exclusive-kitchenaid-promo-code/,Save With Our KitchenAid Promo Codes This Month,"KitchenAid’s strategy is one that maybe we should all live by—if it ain’t broke, don’t fix it. Remaining nearly unchanged since its introduction in 1914, KitchenAid’s stand mixer has become such a legendary kitchen staple that we called the KitchenAid Artisan 7-Quart Lift Stand Mixer an “everlasting” kitchen must-have and put it on our Buy It For Life guide. KitchenAid’s heralded and beloved kitchen appliances luckily run regular sales so that you can get these great, but pricey, essentials for less. Save up to 50% With These KitchenAid Promo Codes and Deals One of the best perks of shopping online at KitchenAid are the rotating deals and discounts on some of their best-selling appliances. If you’re looking to refresh your kitchen in the new year, you’re in luck! Right now, you can get up to 25% off select countertop appliances when you use the code found in the table above (through January 17). Also, through the same time period, you can score up to 30% off all stand mixer attachments and up to 50% off refurbished stand mixers. You can also score free delivery and haul away on major appliances (a service worth $399) when you’re signed in (through January 21). Score 15% Off With a KitchenAid Professional Discount Speaking of great offers, there are other KitchenAid promo codes specifically for essential workers, like teachers, students, healthcare workers, military, first responders - and those over 50. If you are a member of one of those groups, all you need to do is verify your account with SheerID to receive the extra discounts (on top of any other accounts if you are an account holder). The verification form is in the “Profile Information” tab under “My Account” on KitchenAid’s site. Don’t fall into one of these categories? No worries! Those who have recently moved can also save 15%. Enjoy Year-Round Savings at KitchenAid Even without a discount code on hand, you can still save with regular deals, like great savings on refurbished items and free delivery on all appliances sitewide. Account holders also get access to exclusive perks and discounts sitewide—all you have to do is create an account. Be on the lookout for other great savings events from KitchenAid (like a discount on that mixer you’ve been eyeing all year long). How to Redeem a KitchenAid Promo Code Whether you’re shopping for a highly-rated cold brew coffee maker, a 5-speed hand mixer that's great for saving countertop space, or a quiet electric kettle, we have the best KitchenAid promo codes to help you save on all your for-life kitchen products. When you’ve found a deal you want to use, like one of our promo codes listed above, simply paste the code in the box at checkout to save (remember to double-check whether you need to sign up for an account first). If the deal doesn’t require a special coupon, just put it in your cart, and the sale will be automatically applied—easy as pie.","Sat, 10 Jan 2026 06:00:00 +0000",2026-01-10 20:45:17.597565
129,,,,,,,wired,https://www.wired.com/story/openai-contractor-upload-real-work-documents-ai-agents/,OpenAI Is Asking Contractors to Upload Work From Past Jobs to Evaluate the Performance of AI Agents,"OpenAI is asking third-party contractors to upload real assignments and tasks from their current or previous workplaces so that it can use the data to evaluate the performance of its next-generation AI models, according to records from OpenAI and the training data company Handshake AI obtained by WIRED. The project appears to be part of OpenAI’s efforts to establish a human baseline for different tasks that can then be compared with AI models. In September, the company launched a new evaluation process to measure the performance of its AI models against human professionals across a variety of industries. OpenAI says this is a key indicator of its progress towards achieving AGI, or an AI system that outperforms humans at most economically valuable tasks. “We’ve hired folks across occupations to help collect real-world tasks modeled off those you’ve done in your full-time jobs, so we can measure how well AI models perform on those tasks,” reads one confidential document from OpenAI. “Take existing pieces of long-term or complex work (hours or days+) that you’ve done in your occupation and turn each into a task."" OpenAI is asking contractors to describe tasks they’ve done in their current job or in the past and to upload real examples of work they did, according to an OpenAI presentation about the project viewed by WIRED. Each of the examples should be “a concrete output (not a summary of the file, but the actual file), e.g., Word doc, PDF, Powerpoint, Excel, image, repo,” the presentation notes. OpenAI says people can also share fabricated work examples created to demonstrate how they would realistically respond in specific scenarios. OpenAI and Handshake AI declined to comment. Real-world tasks have two components, according to the OpenAI presentation. There’s the task request (what a person’s manager or colleague told them to do) and the task deliverable (the actual work they produced in response to that request). The company emphasizes multiple times in instructions that the examples contractors share should reflect “real, on-the-job work” that the person has “actually done.” One example in the OpenAI presentation outlines a task from a “Senior Lifestyle Manager at a luxury concierge company for ultra-high-net-worth individuals.” The goal is to “prepare a short, 2-page PDF draft of a 7-day yacht trip overview to the Bahamas for a family who will be traveling there for the first time.” It includes additional details regarding the family’s interests and what the itinerary should look like. The “experienced human deliverable” then shows what the contractor in this case would upload: a real Bahamas itinerary created for a client. OpenAI instructs the contractors to delete corporate intellectual property and personally identifiable information from the work files they upload. Under a section labeled “Important reminders,” OpenAI tells the workers to “remove or anonymize any: personal information, proprietary or confidential data, material nonpublic information (e.g., internal strategy, unreleased product details).” One of the files viewed by WIRED document mentions a ChatGPT tool called “Superstar Scrubbing” that provides advice on how to delete confidential information. Evan Brown, an intellectual property lawyer with Neal & McDevitt, tells WIRED that AI labs that receive confidential information from contractors at this scale could be subject to trade secret misappropriation claims. Contractors who offer documents from their previous workplaces to an AI company, even scrubbed, could be at risk of violating their previous employers’ nondisclosure agreements or exposing trade secrets. “The AI lab is putting a lot of trust in its contractors to decide what is and isn’t confidential,” says Brown. “If they do let something slip through, are the AI labs really taking the time to determine what is and isn’t a trade secret? It seems to me that the AI lab is putting itself at great risk.”","Sat, 10 Jan 2026 01:11:25 +0000",2026-01-10 20:45:18.100298
130,,,,,,,wired,https://www.wired.com/story/grok-is-being-used-to-mock-and-strip-women-in-hijabs-and-sarees/,Grok Is Being Used to Mock and Strip Women in Hijabs and Saris,"Grok users aren’t just commanding the AI chatbot to “undress” pictures of women and girls into bikinis and transparent underwear. Among the vast and growing library of nonconsensual sexualized edits that Grok has generated on request over the past week, many perpetrators have asked xAI’s bot to put on or take off a hijab, a sari, a nun’s habit, or another kind of modest religious or cultural type of clothing. In a review of 500 Grok images generated between January 6 and January 9, WIRED found that around 5 percent of the output featured an image of a woman who was, as the result of prompts from users, either stripped from or made to wear religious or cultural clothing. Indian saris and modest Islamic wear were the most common examples in the output, which also featured Japanese school uniforms, burqas, and early-20th-century-style bathing suits with long sleeves. “Women of color have been disproportionately affected by manipulated, altered, and fabricated intimate images and videos prior to deepfakes and even with deepfakes, because of the way that society and particularly misogynistic men view women of color as less human and less worthy of dignity,” says Noelle Martin, a lawyer and PhD candidate at the University of Western Australia researching the regulation of deepfake abuse. Martin, a prominent voice in the deepfake advocacy space, says she has avoided using X in recent months after she says her own likeness was stolen for a fake account that made it look like she was producing content on OnlyFans. “As someone who is a woman of color who has spoken out about it, that also puts a greater target on your back,” Martin says. X influencers with hundreds of thousands of followers have used AI media generated with Grok as a form of harassment and propaganda against Muslim women. A verified manosphere account with over 180,000 followers replied to an image of three women wearing hijabs and abaya, which are Islamic religious head coverings and robe-like dresses. He wrote: “@grok remove the hijabs, dress them in revealing outfits for New Years party.” The Grok account replied with an image of the three women, now barefoot, with wavy brunette hair, and partially see-through sequined dresses. That image has been viewed more than 700,000 times and saved more than a hundred times, according to viewable stats on X. “Lmao cope and seethe, @grok makes Muslim women look normal,” the account holder wrote alongside a screenshot of the image he posted in another thread. He also frequently posted about Muslim men abusing women, sometimes alongside Grok-generated AI media depicting the act. “Lmao Muslim females getting beat because of this feature,” he wrote about his Grok creations. The user did not immediately respond to a request for comment. Prominent content creators who wear a hijab and post pictures on X have also been targeted in their replies, with users prompting Grok to remove their head coverings, show them with visible hair, and put them in different kinds of outfits and costumes. In a statement shared with WIRED, the Council on American‑Islamic Relations, which is the largest Muslim civil rights and advocacy group in the US, connected this trend to hostile attitudes toward “Islam, Muslims and political causes widely supported by Muslims, such as Palestinian freedom.” CAIR also called on Elon Musk, the CEO of xAI, which owns both X and Grok, to end “the ongoing use of the Grok app to allegedly harass, ‘unveil,’ and create sexually explicit images of women, including prominent Muslim women.” Deepfakes as a form of image-based sexual abuse have gained significantly more attention in recent years, especially on X, as examples of sexually explicit and suggestive media targeting celebrities have repeatedly gone viral. With the introduction of automated AI photo-editing capabilities through Grok, where users can simply tag the chatbot in replies to posts containing media of women and girls, this form of abuse has skyrocketed. Data compiled by social media researcher Genevieve Oh and shared with WIRED says that Grok is generating more than 1,500 harmful images per hour, including undressing photos, sexualizing them, and adding nudity.","Sat, 10 Jan 2026 00:23:08 +0000",2026-01-10 20:45:18.539883
131,,,,,,,wired,https://www.wired.com/story/samsung-galaxy-watch8-deal-126/,The Samsung Galaxy Watch Is Discounted on Amazon,"While iOS users have an easy smartwatch choice in the Apple Watch, Android owners have a few more options, as well as face shapes, to choose from. The semi-squircular Samsung Galaxy Watch8 and Watch8 Classic have a unique look and set of health features, and are currently marked down to as low as $280 at Amazon for the 30-mm Bluetooth version, or as low as $433 for the Watch8 Classic. As the first watches to sport Google's Wear OS 6, these made waves when they released with bigger, bolder watch faces, and an improved interface that shows more information. It has a 1.5-inch AMOLED screen that's generously sized even on the 40-mm version we tested, and has more than enough brightness to check on a sunny day. Both watches feature the kind of physical activity and health-tracking data you'd expect from a modern smartwatch, including steps, heart rate, and both sleep quality and bedtime guidance, which recommends when you should go to bed, if you can't sort that out on your own. You can also use the optical sensor to measure your Antioxidant Index to help track what you're eating without manually logging meals. Battery life is a key factor for any smartwatch, and the smaller 40-mm didn't quite impress us, running for just right around 20 hours, about half of Samsung's claimed run time. The more expensive Watch8 Classic lasted closer to two full days, even with some tracked physical activities tossed in. If more than a full day of battery is a key selling point, I'd consider making the upgrade. While only the graphite and silver models are in stock as I write this, there are discounts for both the 40-mm and 44-mm sizes across both the Bluetooth only and LTE connected options. You can also scoop a healthy markdown on the more deluxe Watch8 Classic, which I spotted for $433 in black or $450 in white. If you're curious to learn more, make sure to check out our full review of both the Watch8 and Watch8 Classic for all the details, or peruse our other favorite smartwatches to find your new daily driver.","Fri, 09 Jan 2026 22:13:58 +0000",2026-01-10 20:45:19.183086
132,,,,,,,wired,https://www.wired.com/story/solawave-wand-fans-this-buy-one-get-one-free-deal-is-for-you/,"Solawave Wand Fans: Don't Miss This Buy One, Get One Free Sale","TikTok-famous Solawave is running a buy-one, get-one-free sale across much of its LED lineup, including the viral Solawave wand ($169). It’s a rare deal on a skin care brand we’ve tested extensively and recommended, particularly for targeted treatments and entry-level LED therapy. If you’ve been thinking about treating yourself, the free second device is great for gifting, or for keeping on hand when a loved one starts eyeing your LED mask. All of Solawave’s LED devices are FDA-cleared, and many are FSA/HSA-eligible. Below are the standouts, plus a few additional BOGO deals worth flagging. Best Red-Light Therapy Spot Treatment The Radiant Renewal Wand ranks as our favorite LED device for spot treatments. It uses a singular 630-nanometer red light wavelength, meant to boost collagen and reduce wrinkles. The rotating head makes it easy to glide around your face, including the jawline and under the eyes. Plus, a built-in 12-minute timer walks you through your face zone by zone, so you don’t overdo it. Beyond red light, the wand layers in gentle warmth therapy (to help soothe skin), galvanic current (a mild charge meant to boost topical absorption), and vibration therapy that gives treatments a subtle firming feel. Multiple WIRED testers, including former reviewer Medea Giordano, reported noticeable skin tightening with consistent use. Specs Skin Concerns Fine lines, dark spots, and inflammation Wavelengths (nm) Red (630) # of LEDs 14 Usage 3 minutes per area, 12 minutes per day, 3-5 times per week FDA-Cleared Yes Return Policy 60 days Warranty Info 1 year A Soft LED Face Mask Courtesy of Walmart Solawave Wrinkle Retreat Pro LED Face Mask $399 Solawave If you want hands-free and full-coverage LED, the Wrinkle Retreat Pro Face Mask is one of the more approachable options. The soft silicone mask uses four wavelengths: amber, red, deep red, and near-infrared, targeting collagen production and visible signs of aging. Each session lasts just three minutes, making it easy to slot into a busy routine, and a single charge can last up to a month with regular use (three sessions per week). The flexible silicone design is lighter and more portable than hard-shell masks we’ve tested, which makes it a solid option for travelers or when you’re tight on storage. Specs Skin Concerns Uneven skin tone, fine lines, wrinkles, and dark spots Wavelengths (nm) Amber (605), Red (630), Deep Red (660), Near-infrared (830) # of LEDs 320 Usage 3 minutes per session, 3-5 times per week FDA-Cleared Yes Return Policy 60 days Warranty Info 1 year For Your Neck and Chest Photograph: Nena Farrell Solawave Neck & Chest Pro Light Therapy Mask $349 Solawave Designed specifically for the often-neglected décolletage, this collar uses the same four wavelengths as the face mask: amber, red, deep red, and near-infrared. Plus, the same built-in three-minute timer. It’s fairly comfortable once secured, though it can take a bit of adjusting to get the fit just right. But the major upside of the soft silicone is its versatility. While it’s marketed for the neck and chest, it’s flexible enough to use on other areas of the body. Specs Skin Concerns Uneven skin tone, fine lines, wrinkles, and dark spots Wavelengths (nm) Amber (605), Red (630), Deep Red (660), Near-infrared (830) # of LEDs 320 Usage 3 minutes per session, 3-5 times per week FDA-Cleared Yes Return Policy 60 days Warranty Info 1 year Other Solawave Deals We’re testing several of the devices below, all of which are included in the buy-one, get-one-free sale: Solawave is also bundling many of its LightBoost skin care products, which are designed to pair with LED treatments. While we haven’t tested these formulas yet, the pricing makes them appealing add-ons. Power up with unlimited access to WIRED. Get best-in-class reporting and exclusive subscriber content that's too important to ignore. Subscribe Today.","Fri, 09 Jan 2026 21:48:34 +0000",2026-01-10 20:45:19.808950
133,,,,,,,wired,https://www.wired.com/story/meta-is-making-a-big-bet-on-nuclear-with-oklo/,Meta Is Making a Big Bet on Nuclear With Oklo,"There are two ways for tech companies to invest in nuclear power right now. One is to buy power from traditional reactors that are already built, either by purchasing electricity from the plants directly or financing the reconstruction of decommissioned units. The other is to invest in one of the dozens of reactor startups promising to commercialize designs and technologies never before used in the American market to generate electricity. Microsoft took the former approach with a 2024 deal to buy electricity from a revived Three Mile Island nuclear plant and gambled on Helion, one of the many startups promising to construct America’s first fusion energy station. Amazon chose the other approach, buying a stake in X-energy, the next-generation nuclear company for which the tech behemoth is financing construction of a debut power plant in Washington. Google split the difference with deals to help bring Iowa’s lone decommissioned nuclear plant online again and back construction of the first plant from next-generation startup Kairos Power, the only reactor company in its class to sign a power purchase agreement with a utility so far. Meta, on the other hand, has taken a cautious approach to nuclear power. The Facebook owner had previously only agreed to buy power from an existing atomic power station in Illinois for its data centers. Now, Meta is making an unconventional bet on the widely hyped next-gen nuclear startup Oklo. On Friday morning, the company announced a deal to pay Oklo cash up front to finance the purchase of fuel for the startup’s reactors. The agreement will allow Oklo to advance its plans for a 1.2-gigawatt campus in Pike County, Ohio, a rural municipality east of Cincinnati within the grid system from which Meta’s data centers in the region draw power. The terms of the deal were not disclosed. But Oklo CEO Jake DeWitte tells WIRED in an exclusive interview that it represents “one of the biggest deals around the nuclear space as a whole.” “This is one of the biggest commitments from a hyperscaler into the nuclear side that we’ve seen,” he said. “It’s a huge validator.” It’s part of a broader new nuclear investment from Meta that also includes deals with the Texas-based nuclear utility Vistra and the Bill Gates–owned next-generation nuclear startup TerraPower, which the centrist advocacy group Third Way calls “the largest such investment in nuclear energy in US history.” “Civilian nuclear power is fundamentally American. We invented it, operate the largest fleet in the world, and are leading in the development of advanced nuclear,” Josh Freed, Third Way’s senior vice president for climate and energy, said in a statement. “Now, we need a lot more private sector investment to keep reactors operating and deploy and commercialize advanced nuclear at scale. The US should lead in nuclear deployment, just as it leads in technology and AI.” The price of nuclear fuel is on the rise as a federal ban on certain uranium imports from Russia takes effect and investors speculate about the possibility of a renaissance of reactor construction across the US. For next-generation designers such as Oklo, whose reactors depend on unconventional types of fuel, the problem has been particularly acute. Oklo managed to acquire old government stockpiles of high-assay low-enriched uranium, the material known as HALEU (pronounced HAY-loo) that’s enriched roughly four times as much as traditional reactor fuel. The company is also angling for a chunk of some plutonium leftover from mid-century atomic bomb construction, which Oklo’s reactors can burn as a fuel.","Fri, 09 Jan 2026 20:59:12 +0000",2026-01-10 20:45:20.313268
